docs/misc/config.json

{"keymaps":{},"productName":"IntelliJ Platform Plugin SDK","productVersion":"","searchService":"algolia","searchServiceUrl":"https://data.services.jetbrains.com/search/","resizable-sidebar":true,"color-preset":"contrast","webmaster":"https://plugins.jetbrains.com/docs/intellij/getting-help.html","primary-color":"#307FFF","productWebUrl":"https://plugins.jetbrains.com/docs/intellij/welcome.html","searchAlgoliaId":"JWPLKSKZVF","searchAlgoliaApiKey":"bce9ba6ce7419efe813d671244d3bf6a","searchAlgoliaIndexName":"prod_INTELLIJ-SDK-DOCS_HELP","productId":"intellij","feedbackSupport":"https://www.jetbrains.com/support/","feedbackWidget":true,"downloadPage":"https://jb.gg/ipe","logoUrl":"images/intellij-platform-icon.svg","feedbackUrl":"https://forms-service.jetbrains.com/feedback","feedbackRequireEmail":false,"customBanner":{"title":"Join Plugin Developer Conf 2026 — a free online event on November 10 at 1:00 PM UTC. Register","date":"2026-11-10","link":"https://lp.jetbrains.media/plugin-developer-conf-2026?utm_source\u003dsdk_docs\u0026utm_medium\u003dribbon\u0026utm_campaign\u003dplugindevconf2026/","eventType":"Conference","bgTheme":"default"},"stage":"release","downloadTitle":"IntelliJ Platform Explorer","showDownloadButton":true,"searchMaxHits":75,"footer":{"copyright":"2000-2025 JetBrains s.r.o. and contributors. Use of this source code is governed by the Apache 2.0 license.","socials":{"bluesky":{"title":"IntelliJ Platform Plugin SDK on Bluesky","url":"https://bsky.app/profile/platform.jetbrains.com"},"twitter":{"title":"IntelliJ Platform Plugin SDK on X","url":"https://x.com/JBPlatform/"},"blog":{"title":"IntelliJ Platform Plugin SDK Blog","url":"https://blog.jetbrains.com/platform/"},"youtube":{"title":"IntelliJ Platform Plugin SDK on YouTube","url":"https://www.youtube.com/playlist?list\u003dPLQ176FUIyIUZRWGCFY7G9V5zaM00THymY"},"linkedin":{"title":"IntelliJ Platform Plugin SDK on LinkedIn","url":"https://www.linkedin.com/showcase/jetbrains-platform/"}},"links":[{"title":"JetBrains Platform Forum","url":"https://platform.jetbrains.com"},{"title":"IntelliJ Platform Explorer","url":"https://jb.gg/ipe"},{"title":"Plugin Ideas","url":"https://plugins.jetbrains.com/plugin-ideas/"}]},"labels":{"2024.1":{"abbreviation":"2024.1+","name":"2024.1+","description":"Available in IDE version 2024.1 or later"},"2024.2":{"abbreviation":"2024.2+","name":"2024.2+","description":"Available in IDE version 2024.2 or later"},"obsolete-2024.1":{"abbreviation":"Obsolete","name":"Obsolete Since 2024.1","description":"","color":"strawberry"},"IntelliJIDEA":{"abbreviation":"IntelliJ IDEA","name":"IntelliJ IDEA","href":"https://plugins.jetbrains.com/docs/intellij/idea.html","description":"Available only in IntelliJ IDEA."},"IntelliJIDEA_Ultimate":{"abbreviation":"IntelliJ IDEA Ultimate","name":"IntelliJ IDEA Ultimate","href":"https://plugins.jetbrains.com/docs/intellij/idea-ultimate.html","description":"Available only in IntelliJ IDEA Ultimate."},"Deprecated":{"abbreviation":"Deprecated","name":"Deprecated","description":"Deprecated, see notes.","color":"red"},"Obsolete":{"abbreviation":"Obsolete","name":"Obsolete","description":"Obsolete, see notes.","color":"strawberry"},"2019.3":{"abbreviation":"2019.3+","name":"2019.3","description":"Available in IDE version 2019.3 or later"},"2020.1":{"abbreviation":"2020.1+","name":"2020.1+","description":"Available in IDE version 2020.1 or later"},"2020.2":{"abbreviation":"2020.2+","name":"2020.2+","description":"Available in IDE version 2020.2 or later"},"2020.3":{"abbreviation":"2020.3+","name":"2020.3+","description":"Available in IDE version 2020.3 or later"},"2021.3":{"abbreviation":"2021.3+","name":"2021.3+","description":"Available in IDE version 2021.3 or later"},"2022.1":{"abbreviation":"2022.1+","name":"2022.1+","description":"Available in IDE version 2022.1 or later"},"2022.2":{"abbreviation":"2022.2+","name":"2022.2+","description":"Available in IDE version 2022.2 or later"},"2022.3":{"abbreviation":"2022.3+","name":"2022.3+","description":"Available in IDE version 2022.3 or later"},"2023.1":{"abbreviation":"2023.1+","name":"2023.1+","description":"Available in IDE version 2023.1 or later"},"2023.2":{"abbreviation":"2023.2+","name":"2023.2+","description":"Available in IDE version 2023.2 or later"},"2023.3":{"abbreviation":"2023.3+","name":"2023.3+","description":"Available in IDE version 2023.3 or later"},"2024.3":{"abbreviation":"2024.3+","name":"2024.3+","description":"Available in IDE version 2024.3 or later"},"2025.1":{"abbreviation":"2025.1+","name":"2025.1+","description":"Available in IDE version 2025.1 or later"},"2025.2":{"abbreviation":"2025.2+","name":"2025.2+","description":"Available in IDE version 2025.2 or later"},"2025.3":{"abbreviation":"2025.3+","name":"2025.3+","description":"Available in IDE version 2025.3 or later"},"2026.1":{"abbreviation":"2026.1+","name":"2026.1+","description":"Available in IDE version 2026.1 or later"},"2026.2":{"abbreviation":"2026.2+","name":"2026.2+","description":"Available in IDE version 2026.2 or later"},"deprecated":{"abbreviation":"Deprecated","name":"This item is marked as deprecated.","color":"red"},"incubating":{"abbreviation":"Incubating","name":"This item is marked as incubating.","color":"tangerine"},"unavailable":{"abbreviation":"Unavailable","name":"This item is marked as unavailable."}}}

docs/docs/language-server-protocol.md

## Supported IDEs

Since 2025.1, it is also supported in unified [PyCharm without Pro subscription](https://blog.jetbrains.com/pycharm/2025/04/unified-pycharm/).

## LSP Plugin Setup

The plugin must target [IntelliJ IDEA Plugin Development](idea.html) version `2023.2` or later.

### IDE Setup

Since 2024.2, LSP API sources are provided with the `IntelliJ IDEA sources` artifact.
See [Attaching Sources in the IDE](tools-intellij-platform-gradle-plugin.html#attaching-sources-in-the-ide) on how to enable downloading sources.
Then, use `Navigate | Class...` to open the `LspServerState` class.
In the opened editor, invoke Download IntelliJ Platform sources to download and attach sources.

#### Earlier IDE Versions

Due to technical limitations in IDEs before 2024.1, it is necessary to manually attach sources to the IntelliJ IDEA Ultimate dependency.
To do so, when reviewing the compiled class which belongs to the LSP API, run the Choose Sources... action, and point to the
`$IDEA_INSTALLATION$/lib/src/src_lsp-openapi.zip` file.

### 2025.1

* Pull Diagnostics ([textDocument/diagnostic](https://microsoft.github.io/language-server-protocol/specifications/#diagnostic)) (enabled by default in 2025.2) [2025.1.2]